9788190716147,George Orwell,Classics,Fiction,Science Fiction,"1984: A Novel presents George Orwell’s satirical take on totalitarianism, through the tyrannical hold of Big Brother on the dystopian state of Oceania.Summary Of The Book1984: A Novel is a work of dystopian science fiction and literary political fiction by English novelist George Orwell. It explores the concept of totalitarianism and underlines Orwell’s opposition to the same.The novel is set in the fictional province of Oceania, one of the most powerful states in the world. It is a state ruled by The Party, a government that espouses totalitarianism. Under the leadership of a man named Big Brother, The Party tyrannizes the populace, defending its ideology as favouring the greater good. It is divided into fours ministries, which are used to control the people in various ways, from monitoring their public and private lives to reducing rationing, from manipulating information to countering dissension in torturous ways.The protagonist is a man named Winston Smith, who works for The Party in the Ministry of Truth. He has the job of manipulating newspaper articles to ensure that every piece of historical information is in alignment with his party’s ideologies. He secretly harbours the desire to rebel against The Party, a desire he acts upon by keeping a record of his dissenting views on the totalitarian government.His secret betrayal eventually comes to light, leaving his life at the mercy of The Party. His illicit affair with a young mechanic named Julia forms an important part of the plot.The novel highlights themes like nationalism, censorship, sexual repression, constant government surveillance, public mind control, oppression of individuality, all of which are highly applicable to the 21st century political scenario. Seen from the perspective of the modern world, the manner in which Orwell’s prophetic vision has come to life is highly convincing and disturbing.First published in 1949, its premise and principles have become increasingly relevant in modern times. The book has been adapted for film, theatre, music, radio, video games, comics, and other works of literature."
9789380005874,Sigmund Freud,Psychology,Nonfiction,Philosophy,
9788177564808,Satyajit Ray,Mystery,Fiction,Mystery,* হত্যাপুরী * গোলকধাম রহস্য* যত কান্ড কাঠমুন্ডুতে* নেপোলিয়নের চিঠি* টিনটোরেটোর যীশু * অম্বর সেন অন্তর্ধান রহস্য* জাহাঙ্গীরের স্বর্ণমুদ্রা* এবার কান্ড কেদারনাথে* বোসপুকুরে খুনখারাপি* দার্জিলিং জমজমাট* ভূস্বর্গ ভয়ংকর * ইন্দ্রজাল রহস্য* অপ্সরা থিয়েটারের মামলা* শকুন্তলার কন্ঠহার* ডাঃ মুনসীর ডায়রি* গোলাপী মুক্তা রহস্য* লন্ডনে ফেলুদা* নয়ন রহস্য* রবার্টসনের রুবি অসমাপ্ত ফেলুদাঃ* তোতা রহস্য* তোতা রহস্য (দ্বিতীয় খসড়া) * বাক্স রহস্য (প্রথম খসড়া)* আদিত্য বর্ধনের আবিষ্কার
9781416599685,Franz Kafka,Fiction,Classics,Literature,"Enriched Classics offer readers accessible editions of great works of literature enhanced by helpful notes and commentary. Each book includes educational tools alongside the text, enabling students and readers alike to gain a deeper and more developed understanding of the writer and their work.When Gregor Samsa woke up one morning from unsettling dreams, he found himself changed in his bed into a monstrous vermin.So begins The Metamorphosis, one of the most recognizable opening lines in literature. The story of Gregor Samsa, a young man who, after transforming overnight into a giant, beetle-like insect, becomes an object of disgrace to his family, an outsider in his own home, and a quintessentially alienated man. One of the most widely read and influential works of twentieth-century fiction, The Metamorphosis is a harrowing yet absurdly comic meditation on inadequacy, guilt, and isolation. A work in which, in the words of Vladimir Nabokov, “contrast and unity, style and matter, manner and plot are most perfectly integrated.”Enriched Classics enhance your engagement by introducing and explaining the historical and cultural significance of the work, the author’s personal history, and what impact this book had on subsequent scholarship. Each book includes discussion questions that help clarify and reinforce major themes and reading recommendations for further research.Read with confidence."
9788190782616,Margaret Mitchell,Classics,Historical Fiction,Fiction,"A historical romance set in northern Georgia during the drama of the Civil War and Reconstruction years, Gone with the Wind traces the life of Scarlett O'Hara and her relationships with Rhett Butler, and Ashley and Melanie Wilkes. The Novel addresses such themes as survival, romantic love, and how societies structure gender and class.Published in 1936, the epic novel of love and war, Gone with the Wind became an immediate best-seller, bringing first-time novelist MARGARET MITCHELL an overwhelming amount of critical and popular attention.Awarded the 1937 Pulitzer Prize, the novel was adapted as a film in 1939-an achievement that won ten Academy Awards."
9781840220964,Friedrich Engels,Philosophy,Nonfiction,Politics,"A spectre is haunting Europe (and the world). Not, in the twenty-first century, the spectre of communism, but the spectre of capitalism. Marx's prediction that the state would wither away of its own accord has proved inaccurate, and he did not foresee the tyrannies which have ruled large parts of the globe in his name. Indeed, he would have been appalled if he had witnessed them. But his analysis of the evils and dangers of raw capitalism is as correct now as when it was written, and some of his suggestions (progressive income tax, abolition of child labour, free education for all children) are now accepted with little question. In a world where capitalism is no longer held in check by fear of a communist alternative, The Communist Manifesto (with Socialism Utopian and Scientific, Engels's brief and clear exposition of Marxist thought) is essential reading. The Condition of the Working Class in England in 1844 is Engels's first, and probably best-known, book. With Henry Mayhew's London Labour and the London Poor, it was and is the outstanding study of the working class in Victorian England."
9780743487634,Margaret Brantley,Fiction,Classics,Cultural,"ENDURING LITERATURE ILLUMINATED  BY PRACTICAL SCHOLARSHIP  Dostoyevsky's penetrating study of a man for whom the distinction between right and wrong disappears, and a riveting portrait of guilt and retribution.  EACH ENRICHED CLASSIC EDITION INCLUDES:   A concise introduction that gives readers important background information   A chronology of the author's life and work   A timeline of significant events that provides the book's historical context   An outline of key themes and plot points to help readers form their own interpretations   Detailed explanatory notes   Critical analysis, including contemporary and modern perspectives on the work   Discussion questions to promote lively classroom and book group interaction   A list of recommended related books and films to broaden the reader's experience  Enriched Classics offer readers affordable editions of great works of literature enhanced by helpful notes and insightful commentary. The scholarship provided in Enriched Classics enables readers to appreciate, understand, and enjoy the world's finest books to their full potential.  SERIES EDITED BY CYNTHIA BRANTLEY JOHNSON"
9788171676767,Rabindranath Tagore,Poetry,Classics,Fiction,
9788129124227,F. Scott Fitzgerald,Classics,Fiction,Literature,"The exemplary novel of the Jazz Age, F. Scott Fitzgeralds' third book, The Great Gatsby (1925), stands as the supreme achievement of his career. T. S. Eliot read it three times and saw it as the ""first step"" American fiction had taken since Henry James; H. L. Mencken praised ""the charm and beauty of the writing,"" as well as Fitzgerald's sharp social sense; and Thomas Wolfe hailed it as Fitzgerald's ""best work"" thus far. The story of the fabulously wealthy Jay Gatsby and his love for the beautiful Daisy Buchanan, of lavish parties on Long Island at a time when, The New York Times remarked, ""gin was the national drink and sex the national obsession,"" it is an exquisitely crafted tale of America in the 1920s that resonates with the power of myth. A novel of lyrical beauty yet brutal realism, of magic, romance, and mysticism, The Great Gatsby is one of the great classics of twentieth-century literature."
9780141036137,George Orwell,Classics,Fiction,Science Fiction,"Mr. Jones of Manor Farm is so lazy and drunken that one day he forgets to feed his livestock. The ensuing rebellion under the leadership of the pigs Napoleon and Snowball leads to the animals taking over the farm. Vowing to eliminate the terrible inequities of the farmyard, the renamed Animal Farm is organized to benefit all who walk on four legs. But as time passes, the ideals of the rebellion are corrupted, then forgotten. And something new and unexpected emerges..."
9780141182537,Craig Raine,Adult Fiction,Fiction,Literary Fiction,"An Alternate Cover for this ISBN can be found here and here.'Lolita, light of my life, fire of my loins. My sin, my soul.' Poet and pervert, Humbert Humbert becomes obsessed by twelve-year-old Lolita and seeks to possess her, first carnally and then artistically, out of love, 'to fix once for all the perilous magic of numphets'. This seduction is one of many dimensions in Nabokov's dizzying masterpiece, which is suffused with a savage humour and rich, elaborate verbal textures."
9780099582076,Salman Rushdie,Fiction,Cultural,714 users,"Born at the stroke of midnight at the exact moment of India's independence, Saleem Sinai is a special child. However, this coincidence of birth has consequences he is not prepared for: telepathic powers connect him with 1,000 other 'midnight's children' all of whom are endowed with unusual gifts. Inextricably linked to his nation, Saleem's story is a whirlwind of disasters and triumphs that mirrors the course of modern India at its most impossible and glorious."
9780099572831,Mark Haddon,Book Club,Fiction,Classics,"'Lots of things are mysteries. But that doesn't mean there isn't an answer to them'This is Christopher's murder mystery story. There are also no lies in this story because Christopher can't tell lies. Christopher does not like strangers or the colours yellow or brown or being touched. On the other hand, he knows all the countries in the world and their capital cities and every prime number up to 7507. When Christopher decides to find out who killed the neighbour's dog, his mystery story becomes more complicated than he could have ever predicted.BACKSTORY: Meet the author and learn about the background to Christopher's story."
9781476733043,Pearl S. Buck,Classics,Fiction,Historical Fiction,"This Pulitzer Prize-winning classic tells the poignant tale of a Chinese farmer and his family in old agrarian China. The humble Wang Lung glories in the soil he works, nurturing the land as it nurtures him and his family. Nearby, the nobles of the House of Hwang consider themselves above the land and its workers; but they will soon meet their own downfall.Hard times come upon Wang Lung and his family when flood and drought force them to seek work in the city. The working people riot, breaking into the homes of the rich and forcing them to flee. When Wang Lung shows mercy to one noble and is rewarded, he begins to rise in the world, even as the House of Hwang falls."
9780099513780,P.G. Wodehouse,Humor,Classics,Humor,"This is the first Blandings novel, In which P.G. Wodehouse intorduces us to the delightfully dotty Lord Emsworth, his bone-headed younger son, the Hon. Freddie Threepwood, his log-suffering secretary, the Efficient Baxter, and Beach the Blandings butler.As Wodehouse wrote, 'without at least one imposter on the premises, Blandings Castle is never itself'. In Something Fresh there are two, each with an eye on a valuable Egytian amulet which Lord Emsworth has acquired without quite realizing how it came into his pocket. But of course things get a lot more complicated than this..."
9780553213454,John Tenniel,Classics,Fantasy,Fiction,"In 1862 Charles Lutwidge Dodgson, a shy Oxford mathematician with a stammer, created a story about a little girl tumbling down a rabbit hole. Thus began the immortal adventures of Alice, perhaps the most popular heroine in English literature. Countless scholars have tried to define the charm of the Alice books–with those wonderfully eccentric characters the Queen of Hearts, Tweedledum, and Tweedledee, the Cheshire Cat, Mock Turtle, the Mad Hatter et al.–by proclaiming that they really comprise a satire on language, a political allegory, a parody of Victorian children’s literature, even a reflection of contemporary ecclesiastical history. Perhaps, as Dodgson might have said, Alice is no more than a dream, a fairy tale about the trials and tribulations of growing up–or down, or all turned round–as seen through the expert eyes of a child."
9780141439716,Roger Pooley,Classics,Fiction,Christian,"In John Bunyan's hands, a pious tract is transformed into a work of imaginative literature, The Pilgrim's Progress, whose influence - both on work that followed and on the English consciousness as a whole - has been immeasurable. This Penguin Classics edition is edited with an introduction and notes by Roger Pooley.John Bunyan began The Pilgrim's Progress while he was in prison for conducting unauthorised Baptist religious services outside of the Church of England. In this classic allegory, devout everyman Christian abandons his family and the City of Destruction and sets off to find salvation. His path is straight but not easy, and he is beset by trials, including the terrible violence of the destructive Apollyon and the Giant Despair, as he pursues his pilgrimage through the Slough of Despond, the Delectable Mountains and Vanity Fair towards the Celestial City. In the second part of the narrative his wife, Christiana, is escorted by Great-Heart through the same difficult terrain. Written with the urgency of a persecuted faith and a fiery imagination, The Pilgrim's Progress is a spiritual as well as a literary classic.In his introduction, Roger Pooley discusses Bunyan's life and theology, as well as the text's biblical and historical backdrop, its success and critical history. This edition also includes further reading, notes and accompanying seventeenth-century illustrations, a chronology, suggested further reading, notes and an index.John Bunyan (1628-88) was born in Elstow, a village near Bedford. Soon after the Restoration he was arrested for unlicensed preaching and, because he refused to stop, remained in prison in Bedford for twelve years. In 1678 he published the first part of The Pilgrim's Progress. It became an immediate bestseller, running through twelve editions and being translated into Dutch, French and Welsh during Bunyan's lifetime; since then it has been translated into more than two hundred languages.If you enjoyed The Pilgrim's Progress, you might like Julian of Norwich's Revelations of Divine Love, also available in Penguin Classics."
9780141186887,Biyi Bandele-Thomas,Cultural,"1,218 users","1,073 users","Okonkwo is the greatest wrestler and warrior alive , and his fame spreads throughout West Africa life a bush-fire in the harmattan. But when he accidentally kills a clansman, things begin to fall apart. Then Okonkwo returns from exile to find missionaries and colonial governors have arrived in the village. With the world thrown radically off-balance he can only hurtle towards tragedy.A classic in every sense, Chinua Achebe's stark, coolly ironic novel reshaped both African and world literature. First published in 1958, it has sold over ten million copies in forty-five languages, and remains an arresting parable of a proud but powerless man witnessing the ruin of his people.The founding father of the African novel in English - Guardian"
9780099512059,Alexander Pope,Literature,199 users,British Literature,"'Swift's world-famous satire was an instant bestseller...his vision is dark, often verging on the obscene' - GuardianIn the course of his extraordinary travels, Gulliver is captured by miniature people who wage war on each other because of a religious disagreement over how to crack eggs, is sexually assaulted by giants, visits a floating island, and decides that the society of horses is better than that of his fellow men. Swift's tough, filthy and incisive satire has much to say about the state of the world today and is presented here in its unexpurgated entirety."
9780241952481,John Steinbeck,Classics,Fiction,Academic,"'Guys like us, that work on ranches, are the loneliest guys in the world. They got no family. They don't belong no place.'George and his large, simple-minded friend Lennie are drifters, following wherever work leads them. Arriving in California's Salinas Valley, they get work on a ranch. If they can just stay out of trouble, George promises Lennie, then one day they might be able to get some land of their own and settle down some place. But kind-hearted, childlike Lennie is a victim of his own strength. Seen by others as a threat, he finds it impossible to control his emotions. And one day not even George will be able to save him from trouble.Of Mice and Men is a tragic and moving story of friendship, loneliness and the dispossessed."
9780141185101,Susan Shillinglaw,Classics,Fiction,Academic,"The compelling story of two outsiders striving to find their place in an unforgiving world. Drifters in search of work, George and his simple-minded friend Lennie have nothing in the world except each other and a dream--a dream that one day they will have some land of their own. Eventually they find work on a ranch in California’s Salinas Valley, but their hopes are doomed as Lennie, struggling against extreme cruelty, misunderstanding and feelings of jealousy, becomes a victim of his own strength. Tackling universal themes such as the friendship of a shared vision, and giving voice to America’s lonely and dispossessed, Of Mice and Men has proved one of Steinbeck’s most popular works, achieving success as a novel, a Broadway play and three acclaimed films."
9788189497378,,,,,
9788184975970,,,,,
