9788189930646,,,,,
9780143065883,Khushwant Singh,Fiction,Cultural,106 users,"The story in Train To Pakistan begins at the time of the Partition. The country is being divided into India and Pakistan, and in many places along the border, bloody riots affect the proceedings.The tiny village of Mano Majra remains isolated from these outside conflicts. The Sikhs and Muslims in this village live in peace, and the relationship between the two communities is good. The Muslims work as labourers in the village, while the Sikhs own the land.The story centers around this little village, and how the peace in the community is shattered due to a series of events. When news of the riots reach the village, the different communities express their solidarity and support for each other.But trouble arrives in the form of a train carrying the slaughtered bodies of Hindus and Sikhs from the region that is to be Pakistan. Refugees also arrive from these places, their hearts filled with hatred due to the violence that they have witnessed.Slowly, the peaceful village becomes divided. Meanwhile, a money lender named Ram Lal is murdered in the village. In the wake of the new tense atmosphere, the inspector who has been sent down to keep peace fears that this might trigger angry reactions against all Muslims.As the Muslims prepare to board a train leaving for Pakistan, the inspector tries to divert the others' attention by arresting people who are not connected with the murder, like Juggut Singh, the never-do-well of the village, an uneducated and volatile young man who has always been in trouble with the law. He is however extremely loyal towards his own village. He knows the gang that committed the murder, but had refused to take part in killing a person from his own village. The other person arrested is an intellectual political activist, Iqbal Singh.During all this, the tension between the communities heats up due to the influx of refugees. The Sikhs and Hindus of the village, who had once stated their willingness to defend their Muslim neighbors against t"
9780140446036,L.N. Rangarajan,Politics,History,Cultural,"The Arthashastra is an ancient Indian treatise on statecraft, economic policy and military strategy, written in Sanskrit. It identifies its author by the names 'Kauṭilya' and 'Vishnugupta', both names that are traditionally identified with Chanakya (c. 350–283 BC), who was a scholar at Takshashila and the teacher and guardian of Emperor Chandragupta Maurya, founder of the Mauryan Empire. The text was influential until the 12th century, when it disappeared. It was rediscovered in 1904 by R. Shamasastry, who published it in 1909. The first English translation was published in 1915.Roger Boesche describes the Arthaśāstra as ""a book of political realism, a book analysing how the political world does work and not very often stating how it ought to work, a book that frequently discloses to a king what calculating and sometimes brutal measures he must carry out to preserve the state and the common good.""Centrally, Arthaśāstra argues how in an autocracy an efficient and solid economy can be managed. It discusses the ethics of economics and the duties and obligations of a king. The scope of Arthaśāstra is, however, far wider than statecraft, and it offers an outline of the entire legal and bureaucratic framework for administering a kingdom, with a wealth of descriptive cultural detail on topics such as mineralogy, mining and metals, agriculture, animal husbandry, medicine and the use of wildlife. The Arthaśāstra also focuses on issues of welfare (for instance, redistribution of wealth during a famine) and the collective ethics that hold a society together."
9788172235789,Russell Munson,Fiction,Classics,Philosophy,
9780007282548,Agatha Christie,Mystery,Fiction,Mystery,"Considered to be one of Agatha Christie's most controversial mysteries, The Murder of Roger Ackroyd breaks all the rules of traditional mystery writing. The peaceful English village of King’s Abbot is stunned. First, the attractive widows Ferrars dies from an overdose of veronal. Not twenty-four hours later, Roger Ackroyd—the man she had planned to marry—is murdered. It is a baffling, complex case involving blackmail, suicide, and violent death, a cast that taxes Hercule Poirot’s “little grey cells” before he reaches one of the most startling conclusions of his fabled career."
9788129116116,George Orwell,Classics,Fiction,Science Fiction,"Winston Smith is a low-rung member of the Party, the ruling government of Oceania. He works in the Ministry of Truth, the Party's propoganda arm, where he is in charge of revising history. He is but a small brick in the pyramid that is the Party, at the head of which stands Big Brother. Big Brother the infallible. Big Brother the all-powerful.In a totalitarian society, where indicviduality is suppressed and freedom of thought has its antithesis in the Thought Police, WInston finds respite in the company of Julia. Originality of thought awakens, love bloosoms and hope is rekindled. But what they don't know is that Big Brother is always watching..."
9780099419785,Harper Lee,Classics,Fiction,Historical Fiction,"Harper Lee's Pulitzer Prize-winning masterwork of honor and injustice in the deep South ― and the heroism of one man in the face of blind and violent hatred.One of the best-loved stories of all time, To Kill a Mockingbird has been translated into more than forty languages, sold more than thirty million copies worldwide, served as the basis of an enormously popular motion picture, and was voted one of the best novels of the twentieth century by librarians across the country. A gripping, heart-wrenching, and wholly remarkable tale of coming-of-age in a South poisoned by virulent prejudice, it views a world of great beauty and savage inequities through the eyes of a young girl, as her father ― a crusading local lawyer ― risks everything to defend a black man unjustly accused of a terrible crime."
9780553212426,Loren D. Estleman,Classics,Mystery,Fiction,"Sherlock HolmesThe Complete Novels and StoriesVolume IISince his first appearance in Beeton’s Christmas Annual in 1887, Sir Arthur Conan Doyle’s Sherlock Holmes has been one of the most beloved fictional characters ever created. Now, in two paperback volumes, Bantam presents all fifty-six short stories and four novels featuring Conan Doyle’s classic hero--a truly complete collection of Sherlock Holmes’s adventures in crime!Volume II begins with The Hound of the Baskervilles, a haunting novel of murder on eerie Grimpen Moor, which has rightly earned its reputation as the finest murder mystery ever written. The Valley of Fear matches Holmes against his archenemy, the master of imaginative crime, Professor Moriarty. In addition, the loyal Dr. Watson has faithfully recorded Holmes’s feats of extraordinary detection in such famous cases as the thrilling The Adventure of the Red Circle and the twelve baffling adventures from The Case Book of Sherlock Holmes. Conan Doyle’s incomparable tales bring to life a Victorian England of horse-drawn cabs, fogs, and the famous lodgings at 221B Baker Street, where for more than forty years Sherlock Holmes earned his undisputed reputation as the greatest fictional detective of all time."
9780553328257,Arthur Conan Doyle,Classics,Mystery,Fiction,
9780140246063,Ruskin Bond,Fiction,Cultural,3 users,"The essential Ruskin Bond Delhi Is Not Far brings together the best of Ruskin Bond's prose and poetry. For over four decades, by way of innumerable novels, essays, short stories, and poems, the author has mapped out and peopled a unique literary landscape. This anthology has selections from all of his major books and also features an unpublished novella, Delhi Is Not Far. About The AuthorRuskin Bond's first novel, The Room on the Roof, written when he was seventeen, won the John Llewellyn Rhys Memorial Prize in 1957. Since then he has written several novellas (including Vagrants in the Valley, A Flight of Pigeons and Delhi Is Not Far), essays, poems and children's books, many of which have been published by Penguin India. He has also written over 500 short stories and articles that have appeared in a number of magazines and anthologies. He received the Sahitya Akademi Award in 1993 and the Padma Shri in 1999."
9780451191144,Ayn Rand,Fiction,Classics,Philosophy,"""This is the story of a man who said that he would stop the motor of the world - and did. Was he a destroyer or the greatest of liberators? Why did he have to fight his battle, not against his enemies, but against those who needed him most, and his hardest battle against the woman he loved? What is the world's motor - and the motive power of every man? You will know the answer to these questions when you discover the reason behind the baffling events that play havoc with the lives of the characters in this story."" ""Tremendous in its scope, this novel presents an astounding panorama of human life - from the productive genius who becomes a worthless playboy - to the great steel industrialist who does not know that he is working for his own destruction - to the philosopher who becomes a pirate - to the composer who gives up his career on the night of his triumph - to the woman who runs a transcontinental railroad - to the lowest track worker in her Terminal tunnels."" This is a mystery story, not about the murder of a man's body, but about the murder - and rebirth - of man's spirit."
9789382616597,Margaret Mitchell,Classics,Historical Fiction,Fiction,"Margaret Mitchell's epic novel of love and war won the Pulitzer Prize and one of the most popular and celebrated movies of all time. Many novels have been written about the Civil War and its aftermath. None take us into the burning fields and cities of the American South as Gone With the Wind does, creating haunting scenes and thrilling portraits of characters so vivid that we remember their words and feel their fear and hunger for the rest of our lives. In the two main characters, the white-shouldered, irresistible Scarlett and the flashy, contemptuous Rhett, Margaret Mitchell not only conveyed a timeless story of survival under the harshest of circumstances, she also created two of the most famous lovers in the English-speaking world since Romeo and Juliet."
9788172234881,Sidney Sheldon,Fiction,Thriller,Mystery,"If Tomorrow Comes is the story of Tracy Whitney, a young girl living a seemingly perfect life. Blessed with beauty and intelligence, Tracy works as a computer operator for a bank. She is all set to marry the love of her life and step into a wealthy, glamorous world. One simple conversation later, her idyllic existence stands shattered and her innocence lost forever. Framed by the mafia and cruelly deserted by her love, she ends up in prison. There she is subjected to extremes of violence and sexual harassment. Tracy vows to avenge the destruction of her life at any cost. Rising from her ordeal like a phoenix, she is strengthened by a hatred for her enemies and a thirst for revenge. She begins her life anew as a con artist. From London to Paris, from Madrid to Amsterdam, Tracy’s cons take her all over Europe. While remaining elusive herself, she cunningly pits her enemies against each other, beating them at their own game. Only two people seem to be capable of matching Tracy’s brilliance - a conman named Jeff Stevens and an insurance investigator named Daniel Cooper."
9788171674039,Jerome K. Jerome,Classics,Fiction,Humor,"Martyrs to hypochondria and general seediness, J. and his friends George and Harris decide that a jaunt up the Thames would suit them to a ‘T’. But when they set off, they can hardly predict the troubles that lie ahead with tow-ropes, unreliable weather forecasts and tins of pineapple chunks—not to mention the devastation left in the wake of J.’s small fox-terrier Montmorency.Three Men in a Boat was an instant success when it appeared in 1889, and, with its benign escapism, authorial discursions and wonderful evocation of the late-Victorian ‘clerking classes’, it hilariously captured the spirit of its age."
9780099908401,Ernest Hemingway,Classics,Fiction,Literature,
9780140116151,Ruskin Bond,Short Stories,Fiction,Cultural,
9780571200535,William Golding,Classics,Fiction,Young Adult,"Originally published in 1954, William Golding's Lord of the Flies is one of the most disturbing and celebrated novels of modern times.A plane crashes on a desert island. The only survivors are a group of schoolboys. At first they revel in the freedom and celebrate the absence of grown-ups.Soon though, as the boys' fragile sense of order begins to collapse, their fears start to take on a sinister, primitive significance. Suddenly, the world of cricket, homework and adventure stories seems a long way away. The boys are faced with a more pressing reality — survival — and the appearance of a terrifying beast who haunts their dreams.‘No living writer has represented the fragility of man's enterprises so marvelously as Golding.’ A. S. Byatt, Evening Standard"
9780099528128,Mario Puzo,Thriller,Classics,Historical Fiction,"Tyrant, blackmailer, racketeer, murderer - his influence reaches every level of American society. Meet Don Corleone, a friendly man, a just man, a reasonable man. The deadliest lord of the Cosa Nostra. The Godfather.A modern masterpiece,The Godfather is a searing portrayal of the 1940s criminal underworld. It is also the intimate story of the Corleone family, at once drawn together and ripped apart by its unique position at the core of the American Mafia. Still shocking forty years after it was first published, this compelling tale of blackmail, murder and family values is a true classic."
9780140449174,John Bayley,Classics,Fiction,Cultural,"'Everything is finished. I have nothing but you now. Remember that'Anna Karenina seems to have everything - beauty, wealth, popularity and an adored son. But she feels that her life is empty until the moment she encounters the impetuous officer Count Vronsky. Their subsequent affair scandalizes society and family alike and soon brings jealously and bitterness in its wake. Contrasting with this tale of love and self-destruction is the vividly observed story of Levin, a man striving to find contentment and a meaning to his life - and also a self-portrait of Tolstoy himself."
9780670088485,,,,,
9780099536017,Joseph Heller,Classics,Fiction,War,"At the heart of Catch-22 resides the incomparable, malingering bombardier, Yossarian, a hero endlessly inventive in his schemes to save his skin from the horrible chances of war.His problem is Colonel Cathcart, who keeps raising the number of missions the men must fly to complete their service. Yet if Yossarian makes any attempts to excuse himself from the perilous missions that he's committed to flying, he's trapped by the Great Loyalty Oath Crusade, the bureaucratic rule from which the book takes its title: a man is considered insane if he willingly continues to fly dangerous combat missions, but if he makes the necessary formal request to be relieved of such missions, the very act of making the request proves that he's sane and therefore, ineligible to be relieved."
9788129129581,Charles Darwin,Science,Nonfiction,Classics,"It took Charles Darwin more than twenty years to publish this book, in part because he realized that it would ignite a firestorm of controversy. On the Origin of Species first appeared in 1859, and it remains a continuing source of conflict to this day. Even among those who reject its ideas, however, the work's impact is undeniable. In science, philosophy, and theology, this is a book that changed the world.In addition to its status as the focus of a dramatic turning point in scientific thought, On the Origin of Species stands as a remarkably readable study. Carefully reasoned and well-documented in its arguments, the work offers coherent views of natural selection, adaptation, the struggle for existence, survival of the fittest, and other concepts that form the foundation of modern evolutionary theory.http://www.amazon.com/gp/search/ref=s..."
9780008118044,J.R.R. Tolkien,Fantasy,Classics,Fiction,"Bilbo Baggins is a reasonably typical hobbit: fond of sleeping, eating, drinking, parties and presents. However, it is his destiny to travel to the dwarflands in the east, to help slay the dragon Smaug. His quest takes him through enchanted forests, spiders' lairs, and under the Misty Mountains, where he comes across the vile Gollum, and tricks him out of his 'Precious' - a ring that makes its bearer invisible, and wields a terrible power of its own.J.R.R. Tolkien's own description for the original edition:""If you care for journeys there and back, out of the comfortable Western world, over the edge of the Wild, and home again, and can take an interest in a humble hero (blessed with a little wisdom and a little courage and considerable good luck), here is a record of such a journey and such a traveler. The period is the ancient time between the age of Faerie and the dominion of men, when the famous forest of Mirkwood was still standing, and the mountains were full of danger. In following the path of this humble adventurer, you will learn by the way (as he did) - if you do not already know all about these things - much about trolls, goblins, dwarves, and elves, and get some glimpses into the history and politics of a neglected but important period.""""For Mr. Bilbo Baggins visited various notable persons; conversed with the dragon, Smaug the Magnificent; and was present, rather unwillingly, at the Battle of the Five Armies. This is all the more remarkable, since he was a hobbit. Hobbits have hitherto been passed over in history and legend, perhaps because they as a rule preferred comfort to excitement. But this account, based on his personal memoirs, of the one exciting year in the otherwise quiet life of Mr. Baggins will give you a fair idea of the estimable people now (it is said) becoming rather rare. They do not like noise."""
9780140123890,Edith Grossman,Magical Realism,Novels,Classics,"Set in an unnamed Caribbean seaport, Garcia Marquez's extraordinary Love in the Time of Cholera (1988) relates one of literature's most remarkable stories of unrequited love. ""This shining and heartbreaking novel,"" Thomas Pynchon wrote in The New York Times Book Review, is one of those few rare works ""that can even return our worn souls to us."" P Mary Wesley on Garcia Marquez's Love in the Time of Cholera: ""This is the funniest, most moving book I have read and re-read. Each reading discovers fresh delights, a true classic. Garcia Marquez is the greatest South American writer who doesn't hesitate to write of the spiritual and mundane in the same paragraph.""******************************************************De jóvenes, Florentino Ariza y Fermina Daza se enamoran apasionadamente, pero Fermina eventualmente decide casarse con un médico rico y de muy buena familia. Florentino está anonadado, pero es un romántico. Su carrera en los negocios florece, y aunque sostiene 622 pequeños romances, su corazón todavía pertenece a Fermina. Cuando al fin el esposo de ella muere, Florentino acude al funeral con toda intención. A los cincuenta años, nueve meses y cuatro días de haberle profesado amor a Fermina, lo hará una vez más.Con sagacidad humorística y depurado estilo, García Márquez traza la historia excepcional de un amor que no ha sido correspondido por medio siglo. Aunque nunca parece estar propiamente contenido, el amor fluye a través de la novela de mil maneras –alegre, melancólico, enriquecedor, siempre sorprendente-."
9788172153557,Sharadindu Bandyopadhyay,Mystery,9 users,7 users,"Byomkesh Bakshi (Bengali: ব্যোমকেশ বক্সী) is a fictional detective in Bengali literature created by Sharadindu Bandyopadhyay. He is one of the most famous detective characters in Bengali literature. This book contains all of his stories in one volume, including one incomplete story. শরদিন্দু অমনিবাস (প্রথম-দ্বাদশ খণ্ড) গ্রন্থে সঙ্কলিত শরদিন্দু বন্দ্যোপাধ্যায়ের যাবতীয় রচনা বিষয় অনুসারে এক একটি খণ্ডে বিন্যস্ত করার নব পরিকল্পনা অনুযায়ী লেখকের সমুদয় গোয়েন্দা কাহিনী একত্রে ব্যোমকেশ সমগ্র নামে প্রকাশ করা হল। শরদিন্দু অমনিবাস-এর প্রথম, দ্বিতীয় ও দ্বাদশ খণ্ডে বিধৃত ব্যোমকেশ সংক্রান্ত অন্যান্য রচনাগুলিও যেমন, সুকুমার সেনের 'ব্যোমকেশ উপন্যাস', প্রতুলচন্দ্র গুপ্তের 'ব্যোমকেশ, সত্যবতী, সত্যবতীর গাড়ি' ও 'ব্যোমকেশ ও সত্যবতীর প্রস্থান' এবং পার্থ চট্টোপাধ্যায়ের 'ব্যোমকেশের সঙ্গে সাক্ষাৎকার' এই গ্রন্থে (শেষোক্ত দুটি দ্বিতীয় সংস্করণে) যুক্ত করা হয়েছে।শরদিন্দু বন্দ্যোপাধ্যায় ব্যোমকেশ চরিত্রটি নিয়ে ৩৩টি কাহিনী রচনা করেছেন। এর মাঝে ১টি অসম্পূর্ণ। এই কাহিনীগুলি হলঃসত্যান্বেষী, পথের কাঁটা, সীমান্ত-হীরা,মাকড়সার রস, অর্থমনর্থম্‌, চোরাবালি, অগ্নিবাণ, উপসংহার, রক্তমুখী নীলা, ব্যোমকেশ ও বরদা, চিত্রচোর, দুর্গরহস্য, চিড়িয়াখানা, আদিম রিপু, বহ্নি-পতঙ্গ, রক্তের দাগ, মণিমন্ডন, অমৃতের মৃত্যু, শৈলরহস্য, অচিন পাখি, কহেন কবি কালিদাস, অদৃশ্য ত্রিকোণ, খুঁজি খুঁজি নারি, অদ্বিতীয়, মগ্নমৈনাক, দুষ্টচক্র, হেঁয়ালির ছন্দ, রুম নম্বর দুই, ছলনার ছন্দ, শজারুর কাঁটা, বেণীসংহার, লোহার বিস্কুট, বিশুপাল বধ (অসমাপ্ত) ।"
9780141187884,Robert Faggen,Classics,Fiction,Literature,"Tyrannical Nurse Ratched rules her ward in an Oregon State mental hospital with a strict and unbending routine, unopposed by her patients, who remain cowed by mind-numbing medication and the threat of electric shock therapy. But her regime is disrupted by the arrival of McMurphy – the swaggering, fun-loving trickster with a devilish grin who resolves to oppose her rules on behalf of his fellow inmates. His struggle is seen through the eyes of Chief Bromden, a seemingly mute half-Indian patient who understands McMurphy's heroic attempt to do battle with the powers that keep them imprisoned. Ken Kesey's extraordinary first novel is an exuberant, ribald and devastatingly honest portrayal of the boundaries between sanity and madness."
